"id","journal_title","publishers_name","issn_number","link","aim_identifier","medline","google_scholar_index","impact_factor","sjr","h_index","eigen_factor","eigen_metrix","snip","snip_metrix","open_access_journal","listed_in_doaj","present_issn","publisher_in_cope","online_publisher_africa","hosted_on_inasps","country_id","language_id","platform_id","thematic_area_id"
"1037","South African Journal of Labour Relations","UNISA Press",NULL,"nan",False,NULL,False,NULL,False,NULL,False,"nan",False,NULL,False,False,True,False,True,False,"10","1","2","5"
"1038","South African Journal of Libraries and Information Science","Library and Information Association of South Africa (LIASA)",NULL,"nan",False,NULL,False,NULL,False,NULL,False,"nan",False,NULL,True,True,True,False,True,False,"10","1","2","5"
"1039","South African Journal of Philosophy = Suid-Afrikaanse Tydskrif vir Wysbegeerte","Taylor & Francis",NULL,"nan",False,NULL,False,NULL,False,NULL,False,"nan",False,NULL,False,False,False,False,True,False,"10","1","2","5"
"1040","South African Journal of Physiotherapy","AOSIS",NULL,"nan",False,True,True,16,False,NULL,False,"nan",True,"0.92",False,False,True,True,True,False,"10","1","2","2"
"1041","South African Journal of Psychology","SAGE Publishing",NULL,"nan",False,True,True,25,True,39,True,"<0.1",True,"1.01",False,False,True,True,False,False,"10","1","2","2"
"1042","South African Journal of Wildlife Research - 04-month delayed open access","Southern African Wildlife Management Association (SAWMA)",NULL,"nan",False,NULL,False,NULL,False,NULL,False,"nan",False,NULL,False,False,False,False,True,False,"10","1","2","1"
"1043","South African Journal on Human Rights","Taylor & Francis",NULL,"nan",False,NULL,True,10,True,14,False,"nan",False,NULL,False,False,True,True,False,False,"10","1","2","5"
"1044","South African Law Journal","Juta and Company (Pty) Ltd (Juta's Law Journals)",NULL,"nan",False,NULL,True,5,True,3,False,"nan",False,NULL,False,False,True,False,True,False,"10","1","2","5"
"1045","South African Museums Association Bulletin","South African Museums Association (SAMA)",NULL,"nan",False,NULL,False,NULL,False,NULL,False,"nan",False,NULL,False,False,True,False,True,False,"10","1","2","5"
"1046","South African Ophthalmology Journal","New Media",NULL,"nan",False,False,True,3,False,NULL,False,"nan",False,NULL,False,False,True,False,True,False,"10","1","2","2"
"1047","South African Orthopaedic Journal","nan",NULL,"nan",False,True,True,3,False,NULL,False,"nan",False,NULL,False,False,True,False,True,False,"10","1","2","2"
"1048","South African Pharmaceutical and Cosmetic Review","New Media",NULL,"nan",False,False,True,1,False,NULL,False,"nan",False,NULL,False,False,True,False,True,False,"10","1","2","2"
"1049","South African Psychiatry Review","In House Publications",NULL,"nan",True,True,False,NULL,True,11,False,"nan",False,NULL,False,False,True,False,True,False,"10","1","2","2"
"1050","South African Radiographer","Society of Radiographers of South Africa (SORSA)",NULL,"nan",False,True,False,NULL,False,NULL,False,"nan",False,NULL,False,False,True,False,True,False,"10","1","2","2"
"1051","South African Statistical Journal","South African Statistical Association (SASA)",NULL,"nan",False,NULL,False,NULL,True,11,False,"nan",False,NULL,False,False,True,False,True,False,"10","1","2","5"
"1052","South African Yearbook of International Law","Juta and Company (Pty) Ltd (Juta's Law Journals)",NULL,"nan",False,NULL,False,NULL,False,NULL,False,"nan",False,NULL,False,False,True,False,True,False,"10","1","2","5"
"1053","South African Yearbook of International Law","Juta and Company (Pty) Ltd (Juta's Law Journals)",NULL,"nan",False,NULL,False,NULL,False,NULL,False,"nan",False,NULL,False,False,True,False,True,False,"10","1","2","5"
"1054","Southern African Field Archaeology","Albany Museum",NULL,"nan",False,NULL,False,NULL,False,NULL,False,"nan",False,NULL,False,False,True,False,True,False,"10","1","2","1"
"1055","Southern African Forestry Journal","South African Institute of Forestry (SAIF)",NULL,"nan",False,NULL,False,NULL,False,NULL,False,"nan",False,NULL,False,False,True,True,False,False,"10","1","2","1"
"1056","Southern African Humanities","Council of the Natal Museum",NULL,"nan",False,NULL,False,NULL,True,22,False,"nan",False,NULL,False,False,True,False,True,False,"10","1","2","5"
"1057","Southern African Journal for Folklore Studies","UNISA Press",NULL,"nan",False,NULL,False,NULL,False,NULL,False,"nan",False,NULL,False,False,True,False,True,False,"10","1","2","5"
"1058","Southern African Journal of Accountability and Auditing Research","Southern African Institute of Government Auditors (SAIGA)",NULL,"nan",False,NULL,False,NULL,False,NULL,False,"nan",False,NULL,False,False,True,False,True,False,"10","1","2","3"
"1059","Southern African Journal of Demography","Population Association of Southern Africa",NULL,"nan",False,NULL,False,NULL,False,NULL,False,"nan",False,NULL,False,False,True,False,True,False,"10","1","2","5"
"1060","The Southern African Journal of Entrepreneurship and Small Business Management","AOSIS",NULL,"nan",False,NULL,False,NULL,True,4,False,"nan",False,NULL,False,False,True,True,True,False,"10","1","2","3"
"1061","Southern African Journal of Epidemiology and Infection","Medpharm Publications",NULL,"nan",True,True,False,NULL,True,2,False,"nan",False,NULL,True,False,True,True,True,False,"10","1","2","2"
"1062","Southern African Journal of Gynaecological Oncology","nan",NULL,"nan",False,True,False,NULL,False,NULL,False,"nan",False,NULL,True,True,True,False,True,False,"10","1","2","2"
"1063","Southern African Journal of Infectious Diseases","nan",NULL,"nan",True,True,True,12,False,NULL,False,"nan",False,NULL,False,False,True,True,True,False,"10","1","2","2"
"1064","The Southern African Journal of Information and Communication","University of the Witwatersrand",NULL,"nan",False,NULL,False,NULL,False,NULL,False,"nan",False,NULL,False,False,True,False,True,False,"10","1","2","5"
"1065","Southern African Journal of Public Health incorporating Strengthening Health Systems","South African Medical Association NPC",NULL,"nan",False,False,False,NULL,False,NULL,False,"nan",False,NULL,True,False,False,False,True,False,"10","1","2","2"
"1066","Southern African Journal of Social Work and Social Development","UNISA Press",NULL,"nan",False,NULL,True,NULL,True,6,False,"nan",True,"0.24",False,False,True,False,True,False,"10","1","2","5"
"1067","Southern African Public Law","UNISA Press",NULL,"nan",False,NULL,False,NULL,False,NULL,False,"nan",False,NULL,False,False,True,False,True,False,"10","1","2","5"
"1068","Southern African Review of Education with Education with Production","UNISA Press",NULL,"nan",False,NULL,False,NULL,False,NULL,False,"nan",False,NULL,False,False,True,False,True,False,"10","1","2","5"
"1069","Southern Journal for Contemporary History","University of the Free State",NULL,"nan",False,NULL,True,NULL,False,NULL,False,"nan",False,NULL,False,False,False,False,True,False,"10","1","2","5"
"1070","The Specialist Forum","New Media",NULL,"nan",False,False,True,2,False,NULL,False,"nan",False,NULL,False,False,True,False,True,False,"10","1","2","2"
"1071","Specifier","New Media",NULL,"nan",False,NULL,False,NULL,False,NULL,False,"nan",False,NULL,True,False,False,False,True,False,"10","1","2","1"
"1072","Stads- en Streeksbeplanning = Town and Regional Planning","University of the Free State",NULL,"nan",False,NULL,False,NULL,False,NULL,False,"nan",False,NULL,False,False,False,False,True,False,"10","5","2","1"
"1073","Stellenbosch Law Review","Juta and Company (Pty) Ltd (Juta's Law Journals)",NULL,"nan",False,NULL,True,4,False,NULL,False,"nan",False,NULL,False,False,True,False,True,False,"10","1","2","5"
"1074","Stellenbosch Theological Journal","University of Stellenbosch",NULL,"nan",False,NULL,True,8,False,NULL,False,"nan",False,NULL,False,False,True,False,True,False,"10","1","2","5"
"1075","Stilet : Tydskrif van die Afrikaanse Letterkundevereniging","Afrikaanse Letterkundevereniging (ALV)",NULL,"nan",False,NULL,True,2,False,NULL,False,"nan",False,NULL,False,False,False,False,True,False,"10","7","2","5"
"1076","Stockfarm","Plaas Media",NULL,"nan",False,NULL,True,2,False,NULL,False,"nan",False,NULL,False,False,True,False,True,False,"10","1","2","1"
"1077","Studies in Economics and Econometrics","nan",NULL,"nan",False,NULL,False,NULL,True,9,False,"nan",False,NULL,False,False,True,False,True,False,"10","1","2","3"
"1078","Suid-Afrikaanse Tydskrif vir Natuurwetenskap en Tegnologie","Suid-Afrikaanse Akademie vir Wetenskap en Kuns",NULL,"nan",False,NULL,True,4,False,NULL,False,"nan",False,NULL,False,False,True,True,True,False,"10","5","2","1"
"1079","Tanzania Zamani","Historical Association of Tanzania/History Department, University of Dar-es-Salaam",NULL,"nan",False,NULL,False,NULL,False,NULL,False,"nan",False,NULL,False,False,True,False,True,False,"14","1","2","5"
"1080","Tax Breaks","Bellan Media (Pty) Ltd",NULL,"nan",False,NULL,False,NULL,False,NULL,False,"nan",False,NULL,False,False,False,False,True,False,"10","1","2","5"
"1081","Tax Professional","South African Institute of Professional Accountants (SAIPA)",NULL,"nan",False,NULL,False,NULL,False,NULL,False,"nan",False,NULL,True,False,False,False,True,False,"10","1","2","3"
"1082","TAXtalk","TaxTalk",NULL,"nan",False,NULL,True,2,False,NULL,False,"nan",False,NULL,False,False,True,False,True,False,"10","1","2","3"
"1083","TD : The Journal for Transdisciplinary Research in Southern Africa","AOSIS",NULL,"nan",False,NULL,True,17,False,NULL,False,"nan",False,NULL,False,False,False,False,True,False,"10","1","2","5"
"1084","TFM Magazine","The BEE Chamber",NULL,"nan",False,NULL,True,1,False,NULL,False,"nan",False,NULL,False,False,True,False,True,False,"10","1","2","3"
"1085","Theologia Viatorum","AOSIS",NULL,"nan",False,NULL,False,NULL,False,NULL,False,"nan",False,NULL,False,False,True,False,True,False,"10","1","2","5"
"1086","Track Two : Constructive Approaches to Community and Political Conflict","University of Cape Town",NULL,"nan",False,NULL,False,NULL,False,NULL,False,"nan",False,NULL,True,False,False,False,True,False,"10","1","2","5"
"1087","Transactions of the Centre for Business Law","University of the Free State",NULL,"nan",False,NULL,False,NULL,False,NULL,False,"nan",False,NULL,False,False,False,False,True,False,"10","1","2","3"
"1088","Transactions of the Royal Society of South Africa","Taylor & Francis",NULL,"nan",False,NULL,True,14,True,27,False,"nan",True,"0.82",False,False,True,True,False,False,"10","1","2","1"
"1089","Transformation in Higher Education","AOSIS",NULL,"nan",False,NULL,False,NULL,True,3,False,"nan",False,NULL,False,False,True,True,True,False,"10","1","2","5"
"1090","Transport World Africa","Novus Print (Pty) Ltd t/a 3S Media",NULL,"nan",False,NULL,False,NULL,False,NULL,False,"nan",False,NULL,False,False,True,False,True,False,"10","1","2","1"
"1091","Transvaal Agricultural Journal","Department of Agriculture (South Africa)",NULL,"nan",False,NULL,False,NULL,False,NULL,False,"nan",False,NULL,False,False,False,False,True,False,"10","1","2","4"
"1092","Transvaal Museum Memoirs","nan",NULL,"nan",False,NULL,False,NULL,False,NULL,False,"nan",False,NULL,False,False,False,False,True,False,"10","1","2","5"
"1093","Transvaal Museum Monographs","The Transvaal Museum",NULL,"nan",False,NULL,False,NULL,False,NULL,False,"nan",False,NULL,False,False,False,False,True,False,"10","1","2","5"
"1094","TricTrac: Journal of World Mythology and Folklore","UNISA Press",NULL,"nan",False,NULL,False,NULL,False,NULL,False,"nan",False,NULL,False,False,True,False,True,False,"10","1","2","5"
"1095","Tydskrif vir Geesteswetenskappe","Suid-Afrikaanse Akademie vir Wetenskap en Kuns",NULL,"nan",False,NULL,True,7,True,7,True,"<0.1",False,NULL,False,False,True,False,True,False,"10","5","2","5"
"1096","Tydskrif vir Nederlands en Afrikaans","Suider-Afrikaanse Vereniging vir Neerlandistiek",NULL,"nan",False,NULL,False,NULL,False,NULL,False,"nan",False,NULL,False,False,True,False,True,False,"10","8","2","5"
"1097","Ubisi Mail","Agri Connect (Pty) Ltd",NULL,"nan",False,NULL,False,NULL,False,NULL,False,"nan",False,NULL,True,False,True,False,True,False,"10","5","2","5"
"1098","Ubuntu : Journal of Conflict and Social Transformation","Adonis & Abbey Publishers",NULL,"nan",False,NULL,False,NULL,False,NULL,False,"nan",False,NULL,False,False,False,False,True,False,"10","1","2","5"
"1099","Unisa Psychologia","UNISA Press",NULL,"nan",False,True,False,NULL,False,NULL,False,"nan",False,NULL,False,False,True,False,True,False,"10","1","2","2"
"1100","Universitas","nan",NULL,"nan",False,NULL,False,NULL,False,NULL,True,"<0.1",False,NULL,False,False,True,False,True,False,"10","1","2","5"
"1101","Veeplaas","Plaas Media",NULL,"nan",False,NULL,True,NULL,False,NULL,False,"nan",False,NULL,False,False,True,False,True,False,"10","7","2","1"
"1102","Veld & Flora","Botanical Society of South Africa",NULL,"nan",False,NULL,True,3,False,NULL,False,"nan",False,NULL,False,False,True,False,True,False,"10","1","2","1"
"1103","Verbum et Ecclesia","AOSIS",NULL,"nan",False,NULL,True,17,True,12,False,"nan",True,"0.66",False,False,True,True,True,False,"10","5","2","5"
"1104","Vir die Musiekleier","Suider-Afrikaanse Kerk- en Konsertorreliste Vereniging (SAKOV) / Southern African Church and Concert Organists Society",NULL,"nan",False,NULL,False,NULL,False,NULL,False,"nan",False,NULL,True,False,True,False,True,False,"10","5","2","5"
"1105","WAJIBU","Dr. Gerald J. Wanjohi",NULL,"nan",False,NULL,False,NULL,False,NULL,False,"nan",False,NULL,False,False,True,False,True,False,"12","1","2","5"
"1106","Walia","Ethiopian Wildlife and Natural History Society",NULL,"nan",False,NULL,False,NULL,False,NULL,False,"nan",False,NULL,False,False,True,False,True,False,"12","1","2","5"
"1107","Water Wheel","Water Research Commission (WRC)",NULL,"nan",False,NULL,True,4,True,6,False,"nan",False,NULL,True,False,True,False,True,False,"10","1","2","1"
"1108","Water&Sanitation Africa","Novus Print (Pty) Ltd t/a 3S Media",NULL,"nan",False,NULL,True,3,False,NULL,False,"nan",False,NULL,False,False,True,False,True,False,"10","1","2","1"
"1109","Without Prejudice","JetBlue Publishers (Pty) Ltd",NULL,"nan",False,NULL,True,2,False,NULL,False,"nan",False,NULL,False,False,True,False,True,False,"10","1","2","5"
"1110","Wits Journal of Clinical Medicine","Wits University Press",NULL,"nan",False,True,True,8,False,NULL,False,"nan",False,NULL,True,False,True,False,True,False,"10","1","2","2"
"1111","Wolboer / Wool Farmer","Agri Connect (Pty) Ltd",NULL,"nan",False,NULL,True,1,False,NULL,False,"nan",False,NULL,False,False,True,False,True,False,"10","5","2","4"
"1112","Word and Action = Woord en Daad","Reformation Movement of South Africa (REMSA)",NULL,"nan",False,NULL,False,NULL,False,NULL,False,"nan",False,NULL,False,False,False,False,True,False,"10","5","2","5"
"1113","Wound Healing Southern Africa","Medpharm Publications",NULL,"nan",False,True,False,NULL,False,NULL,False,"nan",False,NULL,False,False,True,False,True,False,"10","1","2","2"
"1114","Yearbook of South African Law","Juta and Company (Pty) Ltd (Juta's Law Journals)",NULL,"nan",False,NULL,False,NULL,False,NULL,False,"nan",False,NULL,False,False,True,False,True,False,"10","1","2","5"
"1115","Zambia Library Association Journal","Zambia Library Association",NULL,"nan",False,NULL,False,NULL,False,NULL,False,"nan",False,NULL,False,False,True,False,True,False,"34","1","2","5"
"1116","Zimbabwe Law Journal","University of Zimbabwe",NULL,"nan",False,NULL,False,NULL,False,NULL,False,"nan",False,NULL,False,False,True,False,True,False,"35","1","2","5"
"1117","Africa: Journal of the International African Institute","nan",NULL,"nan",NULL,NULL,NULL,NULL,NULL,NULL,NULL,"nan",NULL,NULL,NULL,NULL,NULL,NULL,NULL,NULL,NULL,NULL,"3",NULL
"1118","Africa Spectrum","Sage Publishing (Institut fur Afrika-Kunde)","     0002-0397","https://journals.sagepub.com/home/afr",False,False,True,2,True,29,True,"<0.001",True,"1.5787",True,True,True,True,NULL,NULL,NULL,NULL,"3","6"
"1119","Africa today","Indiana University Press","19887","nan",NULL,NULL,True,NULL,True,37,NULL,"nan",NULL,NULL,True,NULL,NULL,NULL,NULL,NULL,NULL,NULL,"3","6"
"1120","Africa affairs","nan",NULL,"nan",NULL,NULL,NULL,NULL,NULL,NULL,NULL,"nan",NULL,NULL,NULL,NULL,NULL,NULL,NULL,NULL,NULL,NULL,"3",NULL
"1121","Journal of the Royal African Society","nan",NULL,"nan",NULL,NULL,NULL,NULL,NULL,NULL,NULL,"nan",NULL,NULL,NULL,NULL,NULL,NULL,NULL,NULL,NULL,NULL,"3",NULL
"1122","The African Archaeological Review","nan",NULL,"nan",NULL,NULL,NULL,NULL,NULL,NULL,NULL,"nan",NULL,NULL,NULL,NULL,NULL,NULL,NULL,NULL,NULL,NULL,"3",NULL
"1123","African Arts","African Studies Center","19933","https://www.jstor.org/stable/23276714",False,False,NULL,NULL,NULL,NULL,NULL,"nan",NULL,NULL,NULL,NULL,NULL,NULL,NULL,NULL,NULL,NULL,"3","7"
"1124","African Conflict and Peacebuilding Review","Indiana University Press","       2156695X","nan",False,False,False,0,True,NULL,NULL,"nan",NULL,"0.84",False,False,NULL,NULL,NULL,NULL,NULL,NULL,"3","6"
"1125","African Economic History","University of Wisconsin at Madison","1452258","nan",False,False,False,0,True,13,NULL,"nan",NULL,"1.511",False,False,True,NULL,NULL,NULL,NULL,"9","3","8"
"1126","African Economic History Review","University of Wisconsin Press","3606333","nan",False,False,NULL,NULL,False,NULL,NULL,"nan",NULL,NULL,NULL,NULL,NULL,NULL,NULL,NULL,NULL,"9","3","9"
"1127","African Issues","Cambridge University Press","15484505","nan",False,False,NULL,NULL,NULL,NULL,NULL,"nan",NULL,NULL,NULL,NULL,NULL,NULL,NULL,NULL,NULL,NULL,"3","10"
"1128","Issue: A Journal of Opinion","Cambridge University Press","471607","https://www.jstor.org/stable/i249412",False,False,False,NULL,NULL,NULL,NULL,"nan",NULL,NULL,NULL,NULL,NULL,NULL,NULL,NULL,NULL,NULL,"3","7"
"1129","African Journal of Political Economy / Revue Africaine d'Economie Politique","nan",NULL,"nan",NULL,NULL,NULL,NULL,NULL,NULL,NULL,"nan",NULL,NULL,NULL,NULL,NULL,NULL,NULL,NULL,NULL,NULL,"3",NULL
"1130","African Languages and Cultures","nan",NULL,"nan",NULL,NULL,NULL,NULL,NULL,NULL,NULL,"nan",NULL,NULL,NULL,NULL,NULL,NULL,NULL,NULL,NULL,NULL,"3",NULL
"1131","African Music","nan",NULL,"nan",NULL,NULL,NULL,NULL,NULL,NULL,NULL,"nan",NULL,NULL,NULL,NULL,NULL,NULL,NULL,NULL,NULL,NULL,"3",NULL
"1132","The African Music Society Newsletter","nan",NULL,"nan",NULL,NULL,NULL,NULL,NULL,NULL,NULL,"nan",NULL,NULL,NULL,NULL,NULL,NULL,NULL,NULL,NULL,NULL,"3",NULL
"1133","Newsletter (African Music Society)","nan",NULL,"nan",NULL,NULL,NULL,NULL,NULL,NULL,NULL,"nan",NULL,NULL,NULL,NULL,NULL,NULL,NULL,NULL,NULL,NULL,"3",NULL
"1134","The African Review: A Journal of African Politics, Development and International Affairs","nan",NULL,"nan",NULL,NULL,NULL,NULL,NULL,NULL,NULL,"nan",NULL,NULL,NULL,NULL,NULL,NULL,NULL,NULL,NULL,NULL,"3",NULL
"1135","African Security","nan",NULL,"nan",NULL,NULL,NULL,NULL,NULL,NULL,NULL,"nan",NULL,NULL,NULL,NULL,NULL,NULL,NULL,NULL,NULL,NULL,"3",NULL
"1136","South African Sociological Review","nan",NULL,"nan",NULL,NULL,NULL,NULL,NULL,NULL,NULL,"nan",NULL,NULL,NULL,NULL,NULL,NULL,NULL,NULL,NULL,NULL,"3",NULL
"1137","African Studies Review","Cambridge University Press","2006-7488","nan",False,False,False,NULL,True,54,True,"<0.001",True,"0.88",False,False,True,False,False,NULL,"38","10","3","6"
"1138","ASA Review of Books","Cambridge University Press","3641686","https://www.jstor.org/stable/532598",False,False,True,NULL,False,0,False,"nan",False,NULL,True,False,False,False,False,NULL,NULL,"10","3","6"
"1139","African Studies Bulletin","Cambridge University Press","2326-3083","https://www.jstor.org/stable/523127",False,False,False,NULL,True,NULL,False,"nan",False,NULL,False,False,True,False,False,NULL,"13","10","3","11"
"1140","Afro-Hispanic Review","Department of Spanish and Portuguese at Vanderbilt University in Nashville, Tennessee USA","2788969","https://www.jstor.org/stable/23054478",False,False,True,NULL,False,NULL,False,"nan",False,NULL,False,False,True,False,False,NULL,NULL,"10","3","10"
"1141","Agenda: Empowering Women for Gender Equity","Taylor & Francis","10130950","https://www.jstor.org/stable/4066405",False,False,False,NULL,False,NULL,NULL,"nan",False,NULL,False,False,False,False,False,NULL,NULL,"10","3","10"
"1142","Cahiers d'Études Africaines","Ehess","80055","https://www.jstor.org/journal/cahietudafri",False,False,True,NULL,False,NULL,False,"nan",False,NULL,True,True,True,False,False,NULL,NULL,"2","3","7"
"1143","Feminist Africa","Institute of African Studies","17264596","https://www.jstor.org/journal/feministafrica",False,False,True,0,False,NULL,False,"nan",False,NULL,True,True,True,True,True,NULL,"13","1","3","12"
"1144","History in Africa","Cambridge University Press",NULL,"https://www.jstor.org/journal/historyafrica",False,False,True,0,True,44,False,"nan",True,"0.6",True,True,True,True,False,NULL,NULL,"1","3","13"
"1145","The International Journal of African Historical Studies","Boston University African Studies Center","3617882","https://www.jstor.org/journal/intejafrihiststu",False,False,False,NULL,False,NULL,NULL,"nan",False,NULL,False,False,True,False,False,NULL,NULL,"1","3","13"
"1146","African Historical Studies","Boston University African Studies Center","19992","https://www.jstor.org/stable/220649",False,False,True,NULL,True,23,NULL,"nan",False,NULL,False,False,True,False,False,NULL,NULL,"1","3","13"
"1147","International Journal of Ethiopian Studies","Tsehai Publishers","15434133","https://www.jstor.org/journal/intejethistud",False,False,True,NULL,False,NULL,False,"nan",False,NULL,False,False,True,True,False,NULL,"12","1","3","13"
"1148","Islamic Africa","Brill","2333262X","https://www.jstor.org/journal/islamicafrica",False,False,True,NULL,True,11,False,"nan",False,NULL,True,True,True,False,False,NULL,NULL,"1","3","13"
"1149","Sudanic Africa","Brill","8030685","https://www.jstor.org/stable/25653398",False,False,True,NULL,False,NULL,False,"nan",False,NULL,False,False,True,False,False,NULL,NULL,"1","3","13"
"1150","Journal of African Cultural Studies","Taylor &Francis","13696815","https://www.jstor.org/journal/jafricultstud",False,False,True,NULL,True,20,False,"nan",False,NULL,False,False,True,False,False,NULL,"12","1","3","13"
"1151","African Languages and Cultures","Taylor &Francis","0954416X","nan",False,False,True,NULL,True,3,False,"nan",False,NULL,True,True,True,True,False,NULL,NULL,"10","3","13"
"1152","Journal of African Development","Codesria","0850 3907","https://www.jstor.org/journal/afrdevafrdev",False,False,False,0,False,NULL,False,"nan",False,NULL,True,True,True,False,False,NULL,NULL,"9","3","13"
"1153","Journal of African Foreign Affairs","Adonis and Abbey Publishers","2056564X","nan",False,False,True,0,False,NULL,False,"nan",False,NULL,False,False,True,False,False,NULL,NULL,"1","3","14"
"1154","The Journal of African History","Cambridge University Press","218537","https://www.jstor.org/journal/jafricanhistory",False,False,True,0,False,NULL,False,"nan",False,NULL,False,False,False,False,False,NULL,NULL,"1","3","13"
"1155","Journal of African Law","Cambrifge University Press","218553","https://www.jstor.org/journal/jafricanlaw",False,False,False,0,True,20,True,"<0.001",True,"0.58",True,True,True,True,False,NULL,NULL,"1","3","6"
"1156","Journal of African Union Studies","Adonis and Abbey Publishers","20504292","https://www.jstor.org/journal/jrnlafrunionstud",False,False,True,0,True,7,False,"nan",True,"0.27",False,False,True,False,False,NULL,NULL,"1","3","6"
"1157","Journal of Africana Religions","Penn State University Press","21655405","https://www.jstor.org/journal/jafrireli",False,False,True,0,True,5,False,"nan",False,NULL,False,False,True,False,False,NULL,NULL,"1","3","13"
"1158","University College Review","Institute of Ethiopian Studies","23103973","https://www.jstor.org/journal/univcollrevi",False,False,False,0,False,NULL,False,"nan",False,NULL,True,True,True,False,True,NULL,"12","1","3","13"
"1159","Journal of Higher Education in Africa / Revue de l'enseignement supérieur en Afrique","Codesria","8517762","https://www.jstor.org/journal/jhigheducafri",False,False,True,0,False,NULL,False,"nan",False,NULL,False,False,False,False,False,NULL,NULL,"9","3","13"
"1160","The Journal of Modern African Studies","Cambridge University Press","0022278X","https://www.jstor.org/journal/jmodeafristud",False,False,False,0,False,NULL,False,"nan",False,NULL,False,False,True,True,False,NULL,NULL,"1","3","13"
"1161","Journal of Religion in Africa","Brill","224200","https://www.jstor.org/journal/jreligionafrica",False,False,True,0,True,36,False,"nan",True,"0.59",True,True,True,False,False,NULL,NULL,"1","3","13"
"1162","Journal of Southern African Studies","Taylor &Francis","3057070","https://www.jstor.org/journal/jsoutafristud",False,False,True,0,True,57,True,"<0.002",False,NULL,False,False,True,True,False,NULL,NULL,"1","3","13"
"1163","Journal of the Historical Society of Nigeria","Historical Society of Nigeria","182540","https://www.jstor.org/journal/jhistsocnige",False,False,True,0,False,NULL,False,"nan",False,NULL,False,False,True,False,True,NULL,"7","1","3","13"
"1164","Journal of West African History","Michigan State University Press","23271868","https://www.jstor.org/journal/jwestafrihist",False,False,True,NULL,False,NULL,False,"nan",False,NULL,True,True,True,False,False,NULL,NULL,"1","3","13"
"1165","Mande Studies","nan",NULL,"nan",NULL,NULL,NULL,NULL,NULL,NULL,NULL,"nan",NULL,NULL,NULL,NULL,NULL,NULL,NULL,NULL,NULL,NULL,"3",NULL
"1166","Ethiopianist Notes","Michigan State University Press","10632751","https://www.jstor.org/journal/ethinote",False,False,True,0,False,NULL,False,"nan",False,NULL,False,False,True,False,False,NULL,NULL,"1","3","13"
