"id","journal_title","publishers_name","issn_number","link","aim_identifier","medline","google_scholar_index","impact_factor","sjr","h_index","eigen_factor","eigen_metrix","snip","snip_metrix","open_access_journal","listed_in_doaj","present_issn","publisher_in_cope","online_publisher_africa","hosted_on_inasps","country_id","language_id","platform_id","thematic_area_id"
"1425","Journal of the Democratic Nursing Organisation of South Africa","Democratic Nursing Organisation of South Africa","0379-8577","https://curationis.org.za/index.php/curationis/pages/view/journal-information",True,False,False,NULL,True,27,False,"nan",True,"0.5",True,True,True,True,True,False,"10","1","13","95"
"1426","South African Centre for Epidemiological Modelling and Analysis","South African Centre for Epidemiological Modelling and Analysis",NULL,"https://www.sacema.org/",True,False,False,NULL,False,NULL,False,"nan",False,NULL,True,False,False,False,True,False,"10","1","13","96"
"1427","Uganda Health Bulletin","Ministry of Health Uganda ",NULL,"nan",True,True,False,NULL,False,NULL,False,"nan",False,NULL,True,False,False,False,True,False,"33","1","13","85"
"1428","Uganda Health Information Digest","Sir Albert Cook Medical Library","1028-5105","https://catalogue.umu.ac.ug/bib/31266",False,True,False,NULL,False,NULL,False,"nan",False,NULL,False,False,True,False,True,False,"33","1","13","97"
"1429","Carcinologie Pratique en Afrique","nan",NULL,"nan",True,False,False,NULL,False,NULL,False,"nan",False,NULL,True,False,False,False,False,False,"56","2","13","98"
"1430","Journal Africain de l'imagerie Médicale","Société de Radiologie d’Afrique Noire Francophone","1810-4959","https://jaim-online.net/index.php/jaim",True,False,True,NULL,False,NULL,False,"nan",False,NULL,True,False,True,False,True,True,"6","33","13",NULL
"1431","Publications Medicales Africaines","Société médicale de Côte d'Ivoire","0980-3998","nan",False,True,False,NULL,False,NULL,False,"nan",False,NULL,True,False,False,False,False,False,"60","2","13","99"
"1432","Odonto-Stomatologie Tropicale","APIDPM Sante Tropicale","0251-172X","https://www.santetropicale.com/kiosque/",True,True,True,NULL,True,20,False,"nan",True,"0.108",True,False,True,False,True,False,"61","2","13","100"
"1433","African Journal of Psychiatry","OMICS International","1994-8220","https://www.omicsgroup.org/",True,True,True,NULL,True,32,True,"<0..1 ",True,"0",True,False,True,False,False,False,"10","1","13","101"
"1434","Foro Mundial de la Salud","World Health Organization","0257-3024","nan",True,True,True,NULL,False,NULL,False,"nan",False,NULL,True,False,True,True,False,False,"62","35","13",NULL
"1435","Journal of the Democratic Nursing Organization of South Africa - Curationis","Democratic Nursing Organisation of South Africa","0379-8577","https://curationis.org.za/index.php/curationis/pages/view/journal-information",True,False,True,NULL,True,27,False,"nan",False,NULL,True,True,True,True,True,False,"10","10","13","102"
"1436","Revue de Medecines et Pharmacopees Africaines","Groupe De Recherche Et D Information Sur La Pharmacopee Et L Environnement Tropical Gript","1240-9782","nan",True,True,False,NULL,False,NULL,False,"nan",False,NULL,False,False,True,NULL,False,False,"63","2","13","103"
"1437","Africain de Chirurgie Orthopédique et Traumatologique","African Society of Orthopedic Surgery (SAFO)","2519-9560","https://safoonline.com/jacot-2023-vol8-no2/",True,False,True,NULL,False,NULL,False,"nan",False,NULL,True,True,True,False,True,False,"64","36","13","104"
"1438","African Journal of Biomedical Research","Biomedical Communications Group","1119-5096","https://www.ojshostng.com/index.php/ajbr/about",False,True,True,8,True,20,False,"nan",False,NULL,False,False,True,False,True,True,"7","1","13","2"
"1439","African Journal of Pharmacy and Pharmacology"," Academic Journals","1996-0816","https://academicjournals.org/journal/AJPP",True,True,True,0,True,39,True,"<0.1",True,"1.037",True,True,True,False,True,False,"38","10","13","105"
"1440","Medicare","nan",NULL,"nan",NULL,NULL,NULL,NULL,NULL,NULL,NULL,"nan",NULL,NULL,NULL,NULL,NULL,NULL,NULL,NULL,NULL,NULL,"13",NULL
"1441","Afro-Egyptian Journal of Infectious and Endemic Diseases","Endemic and Tropical Medicine Department, Faculty of Medicine, Zagazig University","2090-7613","https://aeji.journals.ekb.eg/",True,True,True,NULL,False,NULL,False,"nan",False,NULL,True,True,True,False,True,False,"45","37","13","106"
"1442","African Journal of Dentistry and Implantology - Revue de la Médecine Dentaire","African Society of Dentistry and Implantology","2509-2057","https://revues.imist.ma/index.php/AJDI",True,True,False,NULL,False,NULL,False,"nan",False,NULL,True,False,True,False,True,False,"64","38","13","107"
"1443","Journal of the Nigeria Society of Physiotherapy","Nigeria Society Of Physiotherapy","0331-3735","https://nsphysio.org/news/journal-of-nigeria-society-of-physiotherapy-jnsp-2022-edition-out-and-available",True,True,False,NULL,False,NULL,False,"nan",False,NULL,True,False,True,False,True,False,"7","10","13",NULL
"1444","Journal Africain de Pédiatrie et de Génétique Médicale","Société béninoise de pédiatrie","1840-8354","nan",True,False,True,NULL,False,NULL,False,"nan",False,NULL,False,False,False,False,False,False,"2","2","13","108"
"1445","Journal of African Clinical Cases and Reviews/Journal Africain des cas Cliniques et Revues","Journal of African Clinical Cases and Reviews/Journal Africain des cas Cliniques et Revues","1859-5138","https://www.jaccrafrica.com/",True,False,False,NULL,False,NULL,False,"nan",False,NULL,True,False,True,False,True,False,"65","2","13","53"
"1446","IXth International Conference on AIDS and STD in Africa","nan",NULL,"nan",True,True,False,NULL,False,NULL,False,"nan",False,NULL,True,False,False,False,NULL,False,"33","10","13",NULL
"1447","Middle East African Journal of Ophthalmology","Middle East African Council of Ophthalmology (MEACO)","0974-9233","https://journals.lww.com/MEJO/pages/default.aspx",True,True,True,0,True,36,False,"nan",True,"0.428",True,False,True,True,False,False,"66","10","13","109"
"1448","Khartoum Medical Journal","nan",NULL,"nan",True,True,True,NULL,False,NULL,False,"nan",False,NULL,True,False,False,False,True,False,"30","10","13","53"
"1449","Malawian Nurse","National Association Of Nurses Of Malawi",NULL,"nan",True,True,False,NULL,False,NULL,False,"nan",False,NULL,True,False,False,False,False,False,"23","10","13","110"
"1450","African Women and Health","Safe Motherhood Initiative Project In Uganda",NULL,"nan",True,True,False,NULL,False,NULL,False,"nan",False,NULL,False,False,False,False,False,False,"33","10","13","111"
"1451","La Lettre Médicale du Congo","nan","2119-9663","nan",True,False,True,NULL,False,NULL,False,"nan",False,NULL,True,False,True,False,False,False,"56","2","13",NULL
"1452","Nigerian Journal of Clinical and Biomedical Research","Nigerian Institute of Medical Research","1596-0730","https://www.njcbr.org/index.php/njcbr",True,True,False,NULL,False,NULL,False,"nan",False,NULL,True,False,False,False,True,False,"38","10","13","112"
"1453","Postgraduate Medical Journal of Ghana","Ghana College of Physicians and Surgeons (GCPS)","2026-6790 ","nan",True,False,True,NULL,False,NULL,False,"nan",False,NULL,True,False,True,False,True,False,"13","10","13","113"
"1454","Revue Médicale de Madagascar","La Revue Médicale de Madagascar","2222-792X","https://rmm.mg",True,True,True,NULL,False,NULL,False,"nan",False,NULL,True,False,True,False,True,False,"55","2","13","53"
"1455","Libyan International Medical University Journal"," Libyan International Medical University ","2519-139x","nan",True,False,False,NULL,False,NULL,False,"nan",False,NULL,True,True,True,False,False,False,"21","39","13","114"
"1456","The Dar es Salaam Medical Journal","Assn. of Dar es Salaam Medical Students","0856-0099","nan",True,True,False,NULL,False,NULL,False,"nan",False,NULL,True,False,True,False,False,False,"14","10","13","53"
"1457","Uganda Medical Journal","Uganda Medical Association","0301-505X","nan",True,True,False,NULL,False,NULL,False,"nan",False,NULL,False,False,True,False,True,False,"33","10","13","53"
"1458","Communicable Diseases Bulletin for the African Region","nan",NULL,"nan",NULL,NULL,NULL,NULL,NULL,NULL,NULL,"nan",NULL,NULL,NULL,NULL,NULL,NULL,NULL,NULL,NULL,NULL,"13",NULL
"1459","Nigeria Journal of Medicine","National Association of Resident Doctors of Nigeria","1115-2613","nan",True,True,True,NULL,True,25,False,"nan",True,"0.113",True,True,True,True,False,True,"7","1","13","53"
"1460","Pratiques Psychologiques","Elsevier Masso SAS","1269-1763","https://www.sciencedirect.com/journal/pratiques-psychologiques",True,True,True,0,True,15,True,"<0.1 ",True,"0.278",True,False,True,True,False,False,"63","2","13","115"
"1461","Releve Epidemiologique Hebdomadaire 1993","World Health Organization","00498114","https://www.who.int/publications/journals/weekly-epidemiological-record",True,True,False,NULL,True,82,False,"nan",True,"2.517",True,False,True,True,False,False,"62","4","13","53"
"1462","Africa Review Health","nan",NULL,"nan",NULL,NULL,NULL,NULL,NULL,NULL,NULL,"nan",NULL,NULL,NULL,NULL,NULL,NULL,NULL,NULL,NULL,NULL,"13",NULL
"1463","African Journal of Medical Practice","Academy Science Publishers","1023-8190","nan",True,True,False,NULL,False,NULL,False,"nan",False,NULL,False,False,True,False,False,False,"50","10","13","116"
"1464","Journal of Medical Investigations and Practice","College of Medicine and Health Sciences, Abia State University","2787-0170"," http://www.jomip.org",True,False,False,NULL,False,NULL,False,"nan",False,NULL,False,False,True,False,True,True,"38","10","13","117"
"1465","Pan African Medical Journal - Conference Proceedings"," Pan African Medical Journal","1937-8688","nan",True,True,True,NULL,True,49,False,"nan",True,"0.46",True,True,True,True,True,True,"50","10","13","118"
"1466","Psychopathologie Africaine","Société de psychopathologie et d'hygiène mentale de Dakar","0033-314X","nan",True,True,False,NULL,False,NULL,False,"nan",False,NULL,False,False,True,False,False,False,"61","2","13","119"
"1467","African Journal of Health Issues","African Journal of Health Issues","2524-1303"," ojs.ajhsjournal.or.ke",True,False,False,NULL,False,NULL,False,"nan",False,NULL,True,False,True,False,True,True,"23","10","13","120"
"1468","Childhood in Africa: An Interdisciplinary Journal","The Institute for the African Child at Ohio University",NULL,"nan",True,False,False,NULL,False,NULL,False,"nan",False,NULL,False,False,False,False,False,False,NULL,"10","13","121"
"1469","Pan African Medical Journal - Clinical Medicine","The Pan African Medical Journal","2707-2797","https://www.clinical-medicine.panafrican-med-journal.com/",True,True,True,NULL,False,NULL,False,"nan",False,NULL,True,True,True,True,True,False,"11","10","13","122"
"1470","Revue de Medecines et de Pharmacopees Africaines","Groupe De Recherche Et D Information Sur La Pharmacopee Et L Environnement Tropical Gript","1240-9782","nan",True,True,False,NULL,False,NULL,False,"nan",False,NULL,False,False,True,False,False,False,"63","2","13","103"
"1471","Ann-trop-med-parasitol","Abingdon : Taylor & Francis","1364-8594","nan",True,True,True,4,False,NULL,False,"nan",True,"0.773",True,False,True,True,False,False,"54","10","13","123"
"1472","Burkina Medical","nan",NULL,"nan",NULL,NULL,NULL,NULL,NULL,NULL,NULL,"nan",NULL,NULL,NULL,NULL,NULL,NULL,NULL,NULL,"4","38","13",NULL
"1473","African Community Health Newsletter","nan",NULL,"nan",NULL,NULL,NULL,NULL,NULL,NULL,NULL,"nan",NULL,NULL,NULL,NULL,NULL,NULL,NULL,NULL,NULL,NULL,"13",NULL
"1474","Journal of Obstetrics et Gynaecology of Eastern and Central Africa","Kenya Obstetrical and Gynaecological Society","1012-8867","http://kogs.or.ke/",True,True,False,NULL,False,NULL,False,"nan",False,NULL,False,False,True,False,True,True,"50","10","13","124"
"1475","Journal of the Medical and Dental Association of Botswana","nan",NULL,"nan",True,False,False,NULL,False,NULL,False,"nan",False,NULL,False,False,False,False,False,False,"3","10","13",NULL
"1476","Tanzania Journal of Paediatrics","Paediatric Association of Tanzania",NULL,"nan",True,True,False,NULL,False,NULL,False,"nan",False,NULL,False,False,False,False,False,False,"14","10","13",NULL
"1477","Lesotho WHO Newsletter","World Health Organisation",NULL,"nan",True,True,False,NULL,False,NULL,False,"nan",False,NULL,True,False,False,True,False,False,"20","10","13","125"
"1478","Nigerian Journal of Othopedics and Trauma","Nigerian Orthopaedic Association (NOA)","1596-4582","nan",True,True,False,NULL,False,NULL,False,"nan",False,NULL,False,False,True,True,False,True,"38","10","13","126"
"1479","South Africa Journal of Science","South African journal of science","0038-2353","https://www.sajs.co.za/",True,True,True,2,True,69,True,"0.2",True,"0.589",True,True,True,True,True,True,"10","10","13",NULL
"1480","Observatoire de la Sante en Afrique","World Health Organisation",NULL,"www.afro.who.int",True,False,False,NULL,False,NULL,False,"nan",False,NULL,True,False,False,True,True,False,"27","34","13","127"
"1481","North African Journal of Food and Nutrition Research","The North African journal of food and nutrition research","2588-1582","nan",True,True,True,1,False,NULL,False,"nan",False,NULL,True,False,True,False,True,True,"1","10","13","128"
"1482","Health Libraries Review","Oxford  Blackwell Scientific Publications","1471-1834","nan",True,True,True,2,True,52,True,"<0.1",True,"1.226",True,False,True,False,False,False,"53","10","13",NULL
"1483","Journal of the University of Science and Technology; Kumasi; Ghana"," University Books & Publications Committee, Kwame Nkrumah University of Science and Technology (KNUST)"," 0855-0395","nan",True,True,False,NULL,False,NULL,False,"nan",False,NULL,True,False,True,False,True,True,"13","1","13","129"
"1484","Nursing Journal Zimbabwe","nan",NULL,"nan",True,True,False,NULL,False,NULL,False,"nan",False,NULL,False,False,False,False,False,False,"35","10","13",NULL
"1485","Southern Sudan Medical Journal","South Sudan Medical Journal ","2309-4605","nan",True,False,True,NULL,False,NULL,False,"nan",False,NULL,True,True,True,False,True,True,"67","10","13","130"
"1486","Sudanese Journal of Ophthalmology","​Medknow Publications","1858-540X","nan",True,False,True,NULL,False,NULL,False,"nan",False,NULL,True,False,True,True,False,False,"30","10","13",NULL
"1487","The Central African Journal of Medicine","Central African Journal Of Medicine","0008-9176","nan",True,True,False,NULL,True,28,False,"nan",True,"0.298",True,False,True,False,True,True,"35","10","13","53"
"1488","Annals of Tropical Medicine et Parasitology","nan",NULL,"nan",True,True,False,4,True,NULL,False,"nan",True,"0.773",True,False,False,True,False,False,NULL,"10","13",NULL
"1489","E3 Journal of Medical Research","E3 Journals.",NULL,"nan",True,False,True,NULL,False,NULL,False,"nan",False,NULL,True,False,False,False,False,False,NULL,"10","13",NULL
"1490","Journal of Endocrinology; Metabolism and Diabetes of South Africa","Pinelands : SA Medical Association Health and Medical Pub. Group","1608-9677","nan",True,True,True,0,NULL,15,False,"nan",True,"0.311",True,True,True,True,False,True,"10","10","13","131"
"1491","South African Respiratory Journal","nan",NULL,"nan",NULL,NULL,NULL,NULL,NULL,NULL,NULL,"nan",NULL,NULL,NULL,NULL,NULL,NULL,NULL,NULL,"10",NULL,"13",NULL
"1492","Journal of Obstetrics et Gynaecology of Eastern et Central Africa","Kenya Obstetrical and Gynaecological Society (KOGS)","1012-8867","https://www.jogeca.com/index.php/jogeca",True,False,False,NULL,False,NULL,False,"nan",False,NULL,True,False,True,False,True,True,"50","10","13","132"
"1493","Med-vet-entomol","Wiley-Blackwell Publishing Ltd",NULL,"https://resjournals.onlinelibrary.wiley.com/journal/13652915",True,True,True,1,True,92,True,"0.4",True,"0.826",True,False,True,False,False,False,"53","10","13","133"
"1494","Paludisme et Maladies Infectieuses en Afrique","World Health Organization ",NULL,"nan",True,False,False,NULL,False,NULL,False,"nan",False,NULL,False,False,False,True,False,False,NULL,"34","13","134"
"1495","Journal of Middle East and North Africa Sciences","Jomenas Press","2412-8937 ","nan",True,True,True,NULL,False,12,False,"nan",False,NULL,True,False,True,False,False,False,"68","10","13",NULL
"1496","Observatorio Da Saude Africano","World Health Organization ",NULL,"https://iris.who.int/handle/10665/363628",True,False,True,NULL,False,NULL,False,"nan",False,NULL,True,False,False,True,False,False,NULL,"40","13","135"
"1497","Congo Médical","nan",NULL,"nan",True,True,False,NULL,False,NULL,False,"nan",False,NULL,True,False,False,False,False,False,"56","34","13","53"
"1498","IXth International Conference of AIDS and STD in Africa","nan",NULL,"nan",True,True,False,NULL,False,NULL,False,"nan",False,NULL,True,False,False,False,True,False,"33","10","13",NULL
"1499","Medical Research Council of Zimbabwe Newsletter","nan",NULL,"nan",True,True,False,NULL,False,NULL,False,"nan",False,NULL,False,False,False,False,False,False,"35","10","13",NULL
"1500","Sahara Journal of Social Aspects of HIV/AIDS Research Alliance","South African Medical Association, Health and Medical Pub. Group",NULL,"nan",False,True,True,0,True,34,True,"<0.1",True,"0.625",True,True,True,True,False,True,"10","41","13","136"
"1501","BMC Health Services Research","Springer Nature","1472-6963","nan",False,True,True,2,True,146,True,"3.2",True,"1.177",True,True,True,True,False,False,"53","10","13",NULL
"1502","Tropical Journal of Natural Product Research","Natural Product Research group, University of Benin","2616-0684","nan",True,True,True,NULL,True,11,False,"nan",True,"0.373",True,False,True,False,True,False,"38","10","13","137"
"1503","Journal of Obstetrics and Gynaecology; East and Central Africa","Kenya Obstetrical and Gynaecological Society (KOGS)","1012-8867","http://kogs.or.ke/",True,True,False,NULL,False,NULL,False,"nan",False,NULL,False,False,True,False,True,True,"50","10","13","124"
"1504","LUSO : J. SCI. Tech. (Malawi)","nan",NULL,"nan",NULL,NULL,NULL,NULL,NULL,NULL,NULL,"nan",NULL,NULL,NULL,NULL,NULL,NULL,NULL,NULL,NULL,NULL,"13",NULL
"1505","Nigeria Journal of Medical Sciences","Nigerian Association of Resident Doctors ( NARD)","1115-2613","nan",True,True,False,NULL,True,25,False,"nan",False,NULL,True,True,True,True,True,True,"7","10","13",NULL
"1506","Nigeria Journal of Ophthalmology","Ophthalmological Society of Nigeria","0189-9171","nan",True,True,True,NULL,False,NULL,False,"nan",False,NULL,True,False,True,False,True,True,"7","10","13",NULL
"1507","Panafrican Medical Journal","African Field Epidemiology Network","1937-8688","nan",True,True,True,NULL,True,49,False,"nan",True,"0.46",True,True,True,True,True,True,"33","10","13",NULL
"1508","Postgraduate Doctor-African Edition","nan","0142-7946","nan",True,False,False,NULL,False,NULL,False,"nan",False,NULL,False,False,False,NULL,NULL,False,"54",NULL,"13",NULL
"1509","SA Practice Management","Johannesburg Medical Communications","0259-9368","nan",True,True,False,NULL,False,NULL,False,"nan",False,NULL,False,False,True,False,True,False,"10","1","13",NULL
"1510","Sexually Transmitted Infections in Uganda Implications for Control","nan",NULL,"nan",True,False,False,NULL,False,NULL,False,"nan",False,NULL,True,False,False,False,True,False,"33","1","13","138"
"1511","Tanzania Health Research Bulletin","Health Research User's Trust Fund","0856-6496","nan",True,True,False,NULL,False,NULL,False,"nan",False,NULL,True,False,True,False,True,True,"14","1","13","139"
"1512","Journal of the Colleges of Medicine of South Africa","AOSIS Publishing ","2960-110X","https://jcmsa.org.za/index.php/jcmsa",True,False,False,NULL,False,NULL,False,"nan",False,NULL,True,True,True,False,True,False,"10","1","13","53"
"1513","The Ethiopian Journal of Reproductive Health","Ethiopian Society of Obstetricians & Gynecologists (ESOG)","2520-0275 ","https://www.ejrh.org/index.php/ejrh",True,True,False,NULL,True,5,False,"nan",True,"0.194",True,False,True,False,False,True,"12","1","13","140"
"1514","IAR Journal of Medical Sciences","International Academic & Research Consortium","2708-3594","https://iarconsortium.org/iarjms/",False,True,True,NULL,False,NULL,False,"nan",False,NULL,True,False,True,False,False,False,"11","1","14","141"
"1515","IAR Journal of Medicine and Surgery Research","International Academic & Research Consortium","2709-1902","https://jmsrp.or.ke/index.php/jmsrp/",True,False,True,NULL,False,NULL,False,"nan",False,NULL,True,False,True,False,False,False,"11","1","14","142"
"1516","International Journal of Health, Medicine and Nursing Practice","CARI Journals","2710-1150","https://carijournals.org/journals/index.php/IJHMNP",False,False,True,3,False,NULL,False,"nan",False,NULL,True,False,True,False,True,False,"11","1","15","143"
"1517","Journal of Ophthalmology of Eastern, Central and Southern Africa","College of Ophthalmology of Eastern, Central and Southern Africa (COECSA) ","2308-6327","https://joecsa.coecsa.org/index.php/joec",False,False,True,NULL,False,NULL,False,"nan",False,NULL,True,False,True,False,True,False,"11","1",NULL,"144"
"1518","Yenagoa Medical Journal","Yenagoa Medical Journal","2714-3074","https://yenagoamedicaljournal.net/",True,False,NULL,NULL,False,NULL,False,"nan",False,NULL,NULL,False,True,False,True,False,"7","1",NULL,"145"
"1519","West African Journal of Pharmacy","West African Postgraduate College of Pharmacists ","1118-9096","https://wapcpharm.org/journal/",True,True,NULL,NULL,False,NULL,False,"nan",False,NULL,NULL,False,True,False,True,False,"7","1",NULL,"146"
"1520","Nigerian Journal of Periodontal Research","Periodontologist Association of Nigeria (PAN)","2955-1374","https://njpr.ng/",True,False,True,NULL,False,NULL,False,"nan",False,NULL,NULL,False,True,False,True,False,"7","1",NULL,"147"
"1521","Journal of Health, Applied Sciences and Management","Rivers State College Of Health Science & Technology","2756-5343","https://www.rschst.edu.ng/journals/",False,False,NULL,NULL,False,NULL,False,"nan",False,NULL,NULL,False,True,False,True,True,"7","1","1","148"
"1522","Direct Research Journal of Public Health and Environmental Technology","Direct Research Journals","2734-2182","https://directresearchpublisher.org/drjphet/",False,False,NULL,NULL,False,NULL,False,"nan",False,NULL,NULL,False,True,False,True,False,"7","1",NULL,"82"
"1523","African Journal of Infectious Diseases Research","International Scholars Journal ","2756-3340","https://internationalscholarsjournals.org/journal/ajidd/abou",False,False,NULL,NULL,False,NULL,False,"nan",False,NULL,NULL,False,True,False,True,False,"7","1",NULL,"149"
"1524","Bayero Journal of Evidence-Based Physiotherapy","Bayero University Kano","2489-0251","nan",False,True,NULL,NULL,False,NULL,False,"nan",False,NULL,NULL,False,True,False,True,True,"7","1","16","150"
"1525","Journal of Medicine and Medical Research","nan",NULL,"nan",NULL,NULL,NULL,NULL,NULL,NULL,NULL,"nan",NULL,NULL,NULL,NULL,NULL,NULL,NULL,NULL,"7",NULL,NULL,NULL
"1526","Merit Research Journal of Medicine and Medical Sciences","Merit Journals","2354-323X","https://meritresearchjournals.org/journal/mrjmms",False,False,NULL,NULL,False,NULL,False,"nan",False,NULL,NULL,False,True,False,True,False,"7","10",NULL,"151"
"1527","Greener Journal of Medical Science","Greener Journals","2276-7797","https://www.sciencegate.app/source/266648#google_vignette",False,False,NULL,NULL,False,NULL,False,"nan",False,NULL,NULL,False,True,False,True,False,"7","10",NULL,"152"
"1528","Academic Web Journal of Medical Science","nan","2545-4986","nan",False,False,NULL,NULL,False,NULL,False,"nan",False,NULL,NULL,False,True,False,True,False,"7",NULL,NULL,NULL
"1529","Journal of Hippocratic Medicus","nan","2504-9224","nan",False,False,NULL,NULL,False,NULL,False,"nan",False,NULL,NULL,False,True,False,True,False,"7",NULL,NULL,NULL
"1530","Direct Research Journal of Health and Pharmacology","Direct Research Publisher ","2360-9516","https://directresearchpublisher.org/drjhp/",False,False,NULL,NULL,False,NULL,False,"nan",False,NULL,NULL,False,True,False,True,False,"7","10",NULL,"153"
"1531","PhytoChem & BioSub Journal","nan",NULL,"nan",NULL,NULL,NULL,NULL,NULL,NULL,NULL,"nan",NULL,NULL,NULL,NULL,NULL,NULL,NULL,NULL,"7",NULL,NULL,NULL
"1532","Pinnacle Medicine and Medical Sciences","nan","2360-9516","nan",False,False,NULL,NULL,False,NULL,False,"nan",False,NULL,NULL,False,True,False,True,False,"7","10",NULL,"154"
"1533","Greener Journal of Environment Management and Public Safety","Greener Journals","2354-2276","https://gjournals.org/GJEMPS/index.html",False,False,NULL,NULL,False,NULL,False,"nan",False,NULL,NULL,False,True,False,True,False,"7","42",NULL,"155"
"1534","Ewemen Journal of Herbal Chemistry and Pharmacology Research","Ewemen Journals","2488-9164","https://ewemen.com/category/ejhcp",False,False,NULL,NULL,False,NULL,False,"nan",False,NULL,NULL,False,True,False,True,False,"7","10",NULL,"156"
"1535","Benin Journal of Postgraduate Medicine","Association of Resident Doctors (ARD), University of Benin Teaching","0795-0268","https://www.ajol.info/index.php/bjpm/about",True,True,NULL,NULL,False,NULL,False,"nan",False,NULL,NULL,False,True,False,True,True,"7","10","13","53"
"1536","The Nigerian Postgraduate Medical Journal","Wolters Kluwer-Medknow ","1117-1936","https://journals.lww.com/npmj/pages/default.aspx",False,True,NULL,NULL,True,24,False,"nan",True,"0.551",NULL,True,True,True,False,False,"7","10",NULL,"122"
"1537","African Journal of Nursing and Midwifery","International Scholars Journals","2756-3332","https://internationalscholarsjournals.org/journal/ajnm",False,False,NULL,NULL,False,NULL,False,"nan",False,NULL,NULL,False,True,False,True,False,"7","10",NULL,"157"
