"id","journal_title","publishers_name","issn_number","link","aim_identifier","medline","google_scholar_index","impact_factor","sjr","h_index","eigen_factor","eigen_metrix","snip","snip_metrix","open_access_journal","listed_in_doaj","present_issn","publisher_in_cope","online_publisher_africa","hosted_on_inasps","country_id","language_id","platform_id","thematic_area_id"
"507","New Egyptian Journal of Microbiology","nan",NULL,"nan",False,False,False,NULL,False,NULL,False,"nan",False,NULL,False,False,True,False,True,True,"15","1","1","2"
"508","Scientific Medical Journal","nan",NULL,"nan",False,False,False,NULL,False,NULL,False,"nan",False,NULL,False,False,True,False,True,True,"15","1","1","2"
"509","Zagazig Journal of Occupational Health and Safety","Occupational and Environmental Health Services Center, Faculty of Medicine, Zagazig University",NULL,"nan",False,False,False,NULL,False,NULL,False,"nan",False,NULL,False,False,True,True,True,True,"15","1","1","2"
"510","African Journal of Neurological Sciences","Pan African Association of Neurological Sciences",NULL,"nan",True,False,True,3,True,11,False,"nan",False,NULL,True,False,True,False,True,True,"16","1","1","2"
"511","Afrique Science: Revue Internationale des Sciences et Technologie","nan",NULL,"nan",False,False,False,NULL,False,NULL,False,"nan",False,NULL,True,False,False,False,True,True,"16","2","1","2"
"512","Agronomie Africaine","nan",NULL,"nan",False,NULL,True,7,False,NULL,False,"nan",False,NULL,True,False,True,False,True,True,"16","2","1","4"
"513","Sciences & Nature","nan",NULL,"nan",False,NULL,False,NULL,False,NULL,False,"nan",False,NULL,True,False,True,False,True,True,"16","1","1","1"
"514","Journal of the Eritrean Medical Association","nan",NULL,"nan",False,False,False,NULL,False,NULL,False,"nan",False,NULL,True,False,False,False,True,True,"17","1","1","2"
"515","Lwati: A Journal of Contemporary Research","Universal Academic Publishers",NULL,"nan",False,NULL,True,8,False,NULL,False,"nan",False,NULL,True,False,True,False,True,True,"18","1","1","1"
"516","UNISWA Journal of Agriculture","nan",NULL,"nan",False,NULL,False,NULL,False,NULL,False,"nan",False,NULL,False,False,True,False,False,True,"18","1","1","4"
"517","UNISWA Research Journal of Agriculture, Science and Technology","Faculties of Agriculture, Health Sciences and Science of the University of Swaziland",NULL,"nan",False,NULL,False,NULL,False,NULL,False,"nan",False,NULL,False,False,True,False,False,True,"18","1","1","4"
"518","Orapuh Journal","Orapuh, Inc.",NULL,"nan",False,NULL,False,NULL,False,NULL,False,"nan",False,NULL,True,True,True,False,True,True,"19","1","1","1"
"519","Review of Southern African Studies","Institute of Southern African Studies, National University of Lesotho",NULL,"nan",False,NULL,False,NULL,False,NULL,False,"nan",False,NULL,False,False,True,False,True,True,"20","1","1","1"
"520","AlQalam Journal of Medical and Applied Sciences","University of Tripoli Alahlia, Janzur, Libya",NULL,"nan",False,False,False,NULL,False,NULL,False,"nan",False,NULL,True,False,True,False,True,True,"21","1","1","2"
"521","Libyan Journal of Medicine","Taylor & Francis Online",NULL,"nan",True,True,True,19,True,25,True,"<0.1",True,"0.75",True,True,True,True,False,True,"21","1","1","2"
"522","Open Veterinary Journal","Faculty of Veterinary Medicine, University of Tripoli ",NULL,"nan",False,NULL,True,19,True,16,False,"nan",True,"0.61",True,True,True,False,True,True,"21","1","1","4"
"523","Madagascar Conservation & Development","nan",NULL,"nan",False,NULL,False,NULL,False,NULL,False,"nan",False,NULL,True,False,True,False,False,True,"22","1","1","5"
"524","Journal of Development and Communication Studies","Development Media Consulting",NULL,"nan",False,NULL,False,NULL,False,NULL,False,"nan",False,NULL,True,False,True,False,True,True,"23","1","1","5"
"525","Journal of Humanities","nan",NULL,"nan",False,NULL,False,NULL,False,NULL,False,"nan",False,NULL,True,False,True,False,True,True,"23","1","1","5"
"526","Malawi Journal of Science and Technology","Faculty of Science, Chancellor College in Malawi ",NULL,"nan",False,NULL,False,NULL,False,NULL,False,"nan",False,NULL,True,False,True,False,True,True,"23","1","1","1"
"527","Malawi Medical Journal","nan",NULL,"nan",True,True,True,18,True,24,True,"<0.1",True,"0.51",True,True,True,False,True,True,"23","1","1","2"
"528","Archives of Medical and Biomedical Research","International Association of Medical and Biomedical Researchers (IAMBR) and the Society for Free Radical Research Africa (SFRR-Africa)",NULL,"nan",False,False,False,NULL,False,NULL,False,"nan",False,NULL,True,False,True,False,True,True,"24","1","1","2"
"529","Internet Journal of Medical Update – EJOURNAL","nan",NULL,"nan",False,True,False,NULL,False,NULL,False,"nan",False,NULL,False,False,False,False,True,True,"24","1","1","2"
"530","University of Mauritius Research Journal","University of Mauritius",NULL,"nan",False,NULL,False,NULL,False,NULL,False,"nan",False,NULL,True,False,True,False,True,True,"24","1","1","5"
"531","African Journal of Governance and Development","Centro de Investigação Científica (CIC), Artworks Communications",NULL,"nan",False,NULL,False,NULL,False,NULL,False,"nan",False,NULL,False,False,True,False,True,True,"25","1","1","5"
"532","BNR Economic Review","National Bank of Rwanda (NBR) is the central bank of Rwanda.",NULL,"nan",False,NULL,False,NULL,False,NULL,False,"nan",False,NULL,True,False,True,False,True,True,"26","1","1","3"
"533","Rwanda Journal","nan",NULL,"nan",False,NULL,True,NULL,True,6,False,"nan",False,NULL,True,True,True,False,True,True,"26","1","1","5"
"534","Rwanda Journal of Agricultural Sciences","nan",NULL,"nan",False,NULL,False,NULL,False,NULL,False,"nan",False,NULL,True,False,True,False,True,True,"26","1","1","4"
"535","Rwanda Journal of Engineering, Science, Technology and Environment"," University of Rwanda - College of Science and Technology. ",NULL,"nan",False,NULL,False,NULL,False,NULL,False,"nan",False,NULL,True,False,True,False,True,True,"26","1","1","1"
"536","Rwanda Journal of Health Sciences"," Kigali Health Institute",NULL,"nan",False,True,False,NULL,False,NULL,False,"nan",False,NULL,True,False,True,False,True,True,"26","1","1","2"
"537","Rwanda Journal of Medicine and Health Sciences","College of Medicine and Health Sciences, University of Rwanda",NULL,"nan",False,NULL,True,8,False,NULL,False,"nan",False,NULL,True,False,True,False,True,True,"26","1","1","2"
"538","Rwanda Journal of Social Sciences, Humanities and Business","nan",NULL,"nan",False,NULL,False,NULL,False,NULL,False,"nan",False,NULL,True,False,True,False,True,True,"26","1","1","5"
"539","Rwanda Medical Journal","Rwanda Biomedical Centre (RBC)",NULL,"nan",True,True,False,NULL,True,6,False,"nan",True,"0.1",True,True,True,False,True,True,"26","1","1","2"
"540","Rwandan Journal of Education","nan",NULL,"nan",False,NULL,False,NULL,False,NULL,False,"nan",False,NULL,True,False,True,False,True,True,"26","1","1","5"
"541","Africa Development","Council for the Development of Social Science Research in Africa",NULL,"nan",False,NULL,True,NULL,False,NULL,False,"nan",True,"0.48",True,False,True,False,True,True,"27","1","1","5"
"542","African Environment","nan",NULL,"nan",False,NULL,False,NULL,False,NULL,False,"nan",False,NULL,False,False,True,False,True,True,"27","1","1","5"
"543","African Journal of International Affairs","CODESRIA, Dakar, Senegal",NULL,"nan",False,NULL,False,NULL,True,20,False,"nan",False,NULL,True,False,True,False,True,True,"27","1","1","5"
"544","African Sociological Review / Revue Africaine de Sociologie","CODESRIA",NULL,"nan",False,NULL,False,NULL,False,NULL,False,"nan",False,NULL,True,False,True,False,True,True,"27","4","1","5"
"545","Afrika Statistika","Statistics and Probability African Society",NULL,"nan",False,NULL,False,NULL,False,NULL,False,"nan",False,NULL,True,False,True,False,True,True,"27","4","1","5"
"546","Journal des Sciences Pour l'Ingénieur","nan",NULL,"nan",False,NULL,False,NULL,False,NULL,False,"nan",False,NULL,False,False,False,False,True,True,"27","4","1","1"
"547","Sierra Leone Journal of Biomedical Research","College of Medicine and Allied Health Sciences, University of Sierra Leone",NULL,"nan",True,NULL,False,NULL,False,NULL,False,"nan",False,NULL,True,False,True,False,True,True,"28","1","1","1"
"548","South Sudan Medical Journal","Health and Social Sciences Research Institute - South Sudan (HSSRI-SS)",NULL,"nan",True,True,True,8,False,NULL,False,"nan",False,NULL,True,True,True,False,True,True,"29","1","1","2"
"549","Arab Journal of Nephrology and Transplantation","Arab Society of Nephrology and Renal Transplantation.",NULL,"nan",False,True,False,NULL,True,12,False,"nan",False,NULL,True,False,False,False,True,True,"30","1","1","2"
"550","Sudan Journal of Medical Sciences","nan",NULL,"nan",True,True,True,11,False,NULL,False,"nan",False,NULL,True,True,True,False,True,True,"30","1","1","2"
"551","Sudanese Journal of Dermatology","Sudanese Association of Dermatologists",NULL,"nan",True,True,False,NULL,False,NULL,False,"nan",False,NULL,False,False,True,False,True,True,"30","1","1","2"
"552","Journal de la Recherche Scientifique de l’Université de Lomé","Direction de la Recherche de l’Université de Lomé (Togo)",NULL,"nan",False,NULL,True,4,False,NULL,False,"nan",False,NULL,False,False,True,False,True,True,"31","4","1","1"
"553","Journal Tunisien d'ORL et de Chirurgie Cervico-Faciale","nan",NULL,"nan",True,NULL,False,NULL,False,NULL,False,"nan",False,NULL,True,False,True,False,True,True,"32","4","1","1"
"554","International Journal of Modern Anthropology","Tunisian Association of Anthropology,",NULL,"nan",False,NULL,False,NULL,False,NULL,False,"nan",False,NULL,True,True,True,False,True,True,"32","1","1","5"
"555","African Crop Science Journal","African Crop Science Society",NULL,"nan",False,NULL,True,11,False,NULL,False,"nan",False,NULL,True,False,True,False,True,True,"33","1","1","4"
"556","African Health Sciences","Makerere University",NULL,"nan",True,True,True,30,True,54,True,"0.2",True,"0.52",True,False,True,False,True,True,"33","1","1","2"
"557","African Journal of Tropical Hydrobiology and Fisheries","nan",NULL,"nan",False,NULL,False,NULL,False,NULL,False,"nan",False,NULL,False,False,True,False,True,True,"33","1","1","1"
"558","East African Journal of Peace and Human Rights","School of Law, Makerere University",NULL,"nan",False,NULL,False,NULL,False,NULL,False,"nan",False,NULL,False,False,True,False,True,True,"33","1","1","5"
"559","East and Central African Journal of Surgery","nan",NULL,"nan",True,True,True,5,False,NULL,False,"nan",False,NULL,True,False,True,False,True,True,"33","1","1","2"
"560","Eastern Africa Journal of Rural Development","Ugandan Agricultural Economics Association",NULL,"nan",False,NULL,False,NULL,False,NULL,False,"nan",False,NULL,False,False,True,False,True,True,"33","1","1","5"
"561","Journal of Interventional Epidemiology and Public Health","African Field Epidemiology Network (AFENET)",NULL,"nan",False,False,False,NULL,False,NULL,False,"nan",False,NULL,True,False,True,False,True,True,"33","1","1","2"
"562","Journal of Science and Sustainable Development","Uganda Martyrs University Research Directorate",NULL,"nan",False,NULL,False,NULL,False,NULL,False,"nan",False,NULL,True,True,True,False,True,True,"33","1","1","1"
"563","Makerere Journal of Higher Education","Department of Higher Education of Makerere University",NULL,"nan",False,NULL,False,NULL,False,NULL,False,"nan",False,NULL,True,False,True,False,True,True,"33","1","1","1"
"564","Mtafiti Mwafrika (African Researcher)","nan",NULL,"nan",False,NULL,False,NULL,False,NULL,False,"nan",False,NULL,False,False,True,False,True,True,"33","4","1","5"
"565","Pan African Medical Journal","nan",NULL,"nan",True,True,True,40,True,43,False,"nan",True,"0.53",True,True,True,False,True,True,"33","1","1","2"
"566","Uganda Journal","Uganda Society",NULL,"nan",False,NULL,False,NULL,False,NULL,False,"nan",False,NULL,False,False,True,False,True,True,"33","1","1","5"
"567","Uganda Journal of Agricultural Sciences","National Agricultural Research Organisation",NULL,"nan",False,NULL,False,NULL,False,NULL,False,"nan",False,NULL,True,False,True,False,True,True,"33","1","1","4"
"568","Journal of Science and Technology (Zambia)","University of Zambia Press.",NULL,"nan",False,NULL,False,NULL,False,NULL,False,"nan",False,NULL,False,False,True,False,True,True,"34","1","1","1"
"569","Medical Journal of Zambia","Zambia Medical Association",NULL,"nan",True,True,True,7,False,NULL,False,"nan",False,NULL,True,False,True,False,True,True,"34","1","1","2"
"570","African Journal of Social Work","National Association of Social Workers (Zimbabwe)",NULL,"nan",False,NULL,True,13,True,7,False,"nan",True,"0.57",True,True,True,False,True,True,"35","1","1","5"
"571","Central African Journal of Medicine","University of Zimbabwe",NULL,"nan",True,True,False,NULL,True,27,False,"nan",False,NULL,False,False,True,False,True,True,"35","1","1","2"
"572","JASSA: Journal of Applied Science in Southern Africa","School of Social Work, Harare",NULL,"nan",False,NULL,False,NULL,False,NULL,False,"nan",False,NULL,False,False,True,False,True,True,"35","1","1","1"
"573","Journal of Social Development in Africa","School of Social Work, Harare",NULL,"nan",False,NULL,False,NULL,True,14,False,"nan",False,NULL,False,False,True,False,True,True,"35","1","1","5"
"574","Southern Africa Journal of Education, Science and Technology","Bindura University of Science Education (BUSE)",NULL,"nan",False,NULL,False,NULL,False,NULL,False,"nan",False,NULL,True,False,True,False,True,True,"35","1","1","5"
"575","Transactions of the Zimbabwe Scientific Association","Zimbabwe Scientific Association",NULL,"nan",False,NULL,False,NULL,False,NULL,False,"nan",False,NULL,False,False,True,False,True,True,"35","1","1","1"
"576","Zambezia: The Journal of Humanities of the University of Zimbabwe","University of Zimbabwe",NULL,"nan",False,NULL,False,NULL,False,NULL,False,"nan",False,NULL,False,False,False,False,True,True,"35","1","1","5"
"577","Zimbabwe Journal of Educational Research","University of Zimbabwe",NULL,"nan",False,NULL,False,NULL,False,NULL,False,"nan",False,NULL,False,False,True,False,True,True,"35","1","1","5"
"578","Zimbabwe Journal of Technological Sciences","Bulawayo: National University of Science and Technology",NULL,"nan",False,NULL,False,NULL,False,NULL,False,"nan",False,NULL,False,False,False,False,True,True,"35","1","1","1"
"579","Zimbabwe Science News","Zimbabwe Scientific Association",NULL,"nan",False,NULL,False,NULL,False,NULL,False,"nan",False,NULL,False,False,True,False,True,True,"35","1","1","1"
"580","Zimbabwe Veterinary Journal","Zimbabwe Veterinary Association",NULL,"nan",False,NULL,False,NULL,False,NULL,False,"nan",False,NULL,False,False,True,False,True,True,"35","1","1","4"
"581","ACCORD Occasional Paper","ACCORD",NULL,"nan",False,NULL,False,NULL,False,NULL,False,"nan",False,NULL,True,False,False,False,True,False,"10","1","2","5"
"582","The Accountant","South African Institute of Professional Accountants (SAIPA)",NULL,"nan",False,NULL,False,NULL,False,NULL,False,"nan",False,NULL,False,False,False,False,True,False,"10","1","2","3"
"583","Acta Academica","University of the Free State",NULL,"nan",False,NULL,False,NULL,True,12,False,"nan",False,NULL,False,False,True,False,True,False,"10","1","2","5"
"584","Acta Classica : Proceedings of the Classical Association of South Africa","Classical Association of South Africa (CASA)",NULL,"nan",False,NULL,True,3,False,NULL,False,"nan",False,NULL,False,False,False,False,True,False,"10","1","2","5"
"585","Acta Commercii","AOSIS",NULL,"nan",False,NULL,True,17,False,NULL,False,"nan",False,NULL,False,False,True,True,True,False,"10","1","2","3"
"586","Acta Criminologica : African Journal of Criminology & Victimology","Criminological Society of Africa (CRIMSA)",NULL,"nan",False,NULL,True,8,False,NULL,False,"nan",False,NULL,False,False,False,False,True,False,"10","1","2","5"
"587","Acta Germanica : German Studies in Africa","Association for German Studies in Southern Africa",NULL,"nan",False,NULL,False,NULL,False,NULL,False,"nan",False,NULL,False,False,True,False,True,False,"10","1","2","5"
"588","Acta Juridica","Juta and Company (Pty) Ltd (Juta's Law Journals)",NULL,"nan",False,NULL,True,NULL,False,NULL,False,"nan",False,NULL,False,False,True,False,True,False,"10","1","2","5"
"589","Acta Patristica et Byzantina","Taylor & Francis",NULL,"nan",False,NULL,False,NULL,False,NULL,False,"nan",False,NULL,False,False,True,True,False,False,"10","1","2","5"
"590","Acta Structilia : Journal for the Physical and Development Sciences","University of the Free State",NULL,"nan",False,NULL,False,NULL,False,NULL,False,"nan",False,NULL,False,False,False,False,True,False,"10","1","2","5"
"591","Advocate","SA Bar",NULL,"nan",False,NULL,True,NULL,False,NULL,False,"nan",False,NULL,False,False,True,False,True,False,"10","1","2","5"
"592","AFFRIKA Journal of Politics, Economics and Society","Adonis & Abbey Publishers",NULL,"nan",False,NULL,False,NULL,False,NULL,False,"nan",False,NULL,False,False,False,False,True,False,"7","1","2","3"
"593","AFMA Matrix","Plaas Media",NULL,"nan",False,NULL,True,3,False,NULL,False,"nan",False,NULL,False,False,True,False,True,False,"10","1","2","5"
"594","Africa Conflict Monitor","In On Africa",NULL,"nan",False,NULL,False,NULL,False,NULL,False,"nan",False,NULL,False,False,False,False,True,False,"10","1","2","5"
"595","Africa Conflict Monthly Monitor","In On Africa",NULL,"nan",False,NULL,False,NULL,False,NULL,False,"nan",False,NULL,False,False,True,False,True,False,"10","1","2","5"
"596","Africa Country Benchmark Report (ACBR)","In On Africa",NULL,"nan",False,NULL,False,NULL,False,NULL,False,"nan",False,NULL,False,False,False,False,True,False,"10","1","2","5"
"597","Africa Dialogue Monograph Series","ACCORD",NULL,"nan",False,NULL,False,NULL,False,NULL,False,"nan",False,NULL,True,False,False,False,True,False,"10","1","2","5"
"598","Africa Education Review","UNISA Press",NULL,"nan",False,NULL,True,20,True,12,False,"nan",True,"0.54",False,False,True,False,True,False,"10","1","2","5"
"599","Africa Institute Occasional Paper","Human Sciences Research Council (HSRC)",NULL,"nan",False,NULL,False,NULL,False,NULL,False,"nan",False,NULL,False,False,True,False,True,False,"10","1","2","5"
"600","Africa Journal of Comparative Constitutional Law"," Philippa van Aardt ",NULL,"nan",False,NULL,False,NULL,False,NULL,False,"nan",False,NULL,False,False,True,False,True,False,"11","1","2","5"
"601","Africa Journal of Nursing and Midwifery","UNISA Press",NULL,"nan",False,True,True,9,True,10,False,"nan",True,"0.18",False,False,True,False,True,False,"10","1","2","2"
"602","Africa Journal of Public Sector Development and Governance","African Management Development Institutes' Network (AMDIN)",NULL,"nan",False,NULL,False,NULL,False,NULL,False,"nan",False,NULL,False,False,False,False,True,False,"10","1","2","5"
"603","Africa Nazarene University Law Journal","Juta and Company (Pty) Ltd (Juta's Law Journals)",NULL,"nan",False,NULL,False,NULL,False,NULL,False,"nan",False,NULL,False,False,True,False,True,False,"10","1","2","5"
"604","Africa's Public Service Delivery and Performance Review","AOSIS",NULL,"nan",False,NULL,True,14,False,NULL,False,"nan",False,NULL,False,False,False,False,True,False,"10","1","2","3"
"605","Africa Growth Agenda","AfricaGrowth Institute",NULL,"nan",False,NULL,False,NULL,False,NULL,False,"nan",False,NULL,False,False,False,False,True,False,"10","1","2","3"
"606","African Entomology","Entomological Society of South Africa (ESSA)",NULL,"nan",False,NULL,True,13,True,34,True,"<0.1",True,"0.54",False,False,True,False,True,False,"10","1","2","1"
"607","African Evaluation Journal","AOSIS",NULL,"nan",False,False,False,NULL,True,8,False,"nan",False,NULL,False,False,True,True,True,False,"10","1","2","2"
"608","African Finance Journal","AfricaGrowth Institute",NULL,"nan",False,NULL,False,NULL,True,6,False,"nan",False,NULL,False,False,True,False,True,False,"10","1","2","3"
"609","African Historical Review","nan",NULL,"nan",False,NULL,False,NULL,True,8,False,"nan",False,NULL,False,False,True,True,False,False,"10","1","2","5"
"610","African Human Rights Law Journal","Pretoria University Law Press (PULP)","1996-2096","nan",False,NULL,True,9,True,3,False,"nan",False,NULL,False,False,True,True,True,False,"10","1","2","5"
"611","African Invertebrates","ARC Plant Protection Research Institute",NULL,"nan",False,NULL,False,NULL,True,16,False,"nan",False,NULL,True,True,True,False,True,False,"10","1","2","1"
"612","African Journal for Physical Activity and Health Sciences (AJPHES)","AFAHPER-SD",NULL,"nan",False,False,True,6,False,NULL,False,"nan",False,NULL,False,False,False,False,True,False,"10","1","2","2"
"613","African Journal for Physical Health Education, Recreation and Dance","AFAHPER-SD",NULL,"nan",False,True,False,NULL,False,NULL,False,"nan",False,NULL,False,False,False,False,True,False,"10","1","2","2"
"614","African Journal of Business and Economic Research","Adonis & Abbey Publishers",NULL,"nan",False,NULL,True,14,True,9,False,"nan",True,"0.22",False,False,True,False,True,False,"10","1","2","3"
"615","African Journal of Career Development","AOSIS",NULL,"nan",False,NULL,False,NULL,False,NULL,False,"nan",False,NULL,False,False,True,True,True,False,"10","1","2","5"
"616","African Journal of Democracy and Election Research","Adonis & Abbey Publishers",NULL,"nan",False,NULL,False,NULL,False,NULL,False,"nan",False,NULL,False,False,False,False,True,False,"10","1","2","5"
"617","African Journal of Democracy and Governance","Institute for Democracy, Governance, Peace and Development in Africa",NULL,"nan",False,NULL,True,5,False,NULL,False,"nan",False,NULL,False,False,True,False,True,False,"10","1","2","5"
"618","African Journal of Development Studies (formerly AFFRIKA Journal of Politics, Economics and Society)","Adonis & Abbey Publishers",NULL,"nan",False,NULL,False,NULL,False,NULL,False,"nan",False,NULL,False,False,False,False,True,False,"10","1","2","5"
"619","African Journal of Disability","AOSIS",NULL,"nan",True,True,True,25,True,13,False,"nan",True,"1.23",False,False,True,True,True,False,"10","1","2","2"
"620","African Journal of Employee Relations","UNISA Press",NULL,"nan",False,NULL,False,NULL,False,NULL,False,"nan",False,NULL,False,False,False,False,True,False,"10","1","2","3"
"621","African Journal of Farm Child and Youth Development","Children-In-Agriculture Programme (CIAP)",NULL,"nan",False,NULL,False,NULL,False,NULL,False,"nan",False,NULL,True,False,False,False,True,False,"10","1","2","5"
"622","African Journal of Gender, Society and Development (formerly Journal of Gender, Information and Development in Africa)","Adonis & Abbey Publishers",NULL,"nan",False,NULL,False,NULL,False,NULL,False,"nan",False,NULL,False,False,False,False,True,False,"10","1","2","5"
"623","African Journal of Herpetology","Taylor & Francis",NULL,"nan",False,NULL,False,NULL,True,20,True,"<0.1",False,NULL,False,False,True,True,False,False,"10","1","2","1"
"624","The African Journal of Information and Communication","University of the Witwatersrand",NULL,"nan",False,NULL,False,NULL,False,NULL,False,"nan",False,NULL,True,True,True,False,True,False,"10","1","2","5"
"625","African Journal of Inter/Multidisciplinary Studies","Durban University of Technology (DUT)",NULL,"nan",False,NULL,False,NULL,False,NULL,False,"nan",False,NULL,True,True,True,False,True,False,"10","1","2","5"
"626","African Journal of Laboratory Medicine","AOSIS",NULL,"nan",True,True,True,16,True,14,False,"nan",True,"0.36",False,False,True,True,True,False,"10","1","2","2"
"627","African Journal of Peace and Conflict Studies (formerly Ubuntu : Journal of Conflict and Social Transformation)","AOSIS",NULL,"nan",False,NULL,False,NULL,False,NULL,False,"nan",False,NULL,False,False,False,False,True,False,"10","1","2","5"
"628","African Journal of Primary Health Care and Family Medicine","AOSIS",NULL,"nan",False,True,True,NULL,True,27,False,"nan",True,"0.94",False,False,True,True,True,False,"10","1","2","2"
"629","African Journal of Psychological Assessment","AOSIS",NULL,"nan",False,False,False,NULL,False,NULL,False,"nan",False,NULL,False,False,True,True,True,False,"10","1","2","2"
"630","African Journal of Public Affairs","African Consortium of Public Administration (ACPA)",NULL,"nan",False,NULL,True,11,False,NULL,False,"nan",False,NULL,True,False,True,False,True,False,"10","1","2","5"
"631","African Journal of Religion Philosophy and Culture","Adonis & Abbey Publishers",NULL,"nan",False,NULL,True,NULL,False,NULL,False,"nan",False,NULL,False,False,True,False,True,False,"35","1","2","5"
"632","African Journal of Research in Mathematics, Science and Technology Education","Taylor & Francis",NULL,"nan",False,NULL,True,14,True,18,False,"nan",True,"0.57",False,False,True,True,False,False,"10","1","2","1"
"633","African Journal of Rhetoric","African Association for Rhetoric",NULL,"nan",False,NULL,False,NULL,False,NULL,False,"nan",False,NULL,False,False,True,False,True,False,"10","1","2","5"
"634","African Journal of Science, Technology, Innovation and Development","Taylor & Francis",NULL,"nan",False,NULL,True,25,True,19,False,"nan",True,"0.74",False,False,True,True,False,False,"10","1","2","1"
"635","African Journal of Sociological and Psychological Studies","Adonis & Abbey Publishers",NULL,"nan",False,NULL,False,NULL,False,NULL,False,"nan",False,NULL,False,False,False,False,True,False,"10","1","2","5"
"636","African Journal of Terrorism and Insurgency Research","Adonis & Abbey Publishers",NULL,"nan",False,NULL,False,NULL,False,NULL,False,"nan",False,NULL,False,False,True,False,True,False,"10","1","2","5"
